asin,product_title,product_price,product_original_price,product_star_rating,product_num_ratings,product_num_offers,product_minimum_offer_price,is_best_seller,is_amazon_choice,is_prime,climate_pledge_friendly,sales_volume,delivery,has_variations
B0D8PN6CPQ,"TOCOL 3 in 1 Magnetic for iPhone 16 Case, Upgraded Full Camera Protection, Compatible with Magsafe, 16FT Drop Protection, Translucent Matte Back Bumper Phone Cover 6.1-Inch（Black）",14.99,24.99,4.6,4022,1,14.99,False,False,True,True,500,"FREE delivery Tue, Sep 24 on $35 of items shipped by Amazon",False
B0D3F44F6B,"TONEOF 66&quot; Automatic Tripod,Auto-Open Phone Tripod Stand with Magnetic Rechargable Remote,360° Vertical &amp; Horizontal Rotatable Travel Tripod,Stable Cell Phone Tripod for iPhone/Android（Black）",34.99,34.99,4.7,123,1,34.99,False,False,True,False,500,"FREE delivery Tue, Sep 24 on $35 of items shipped by Amazon",False
B0CJ8YT4K5,"Power Charger, 3-in-1 65W GaN Type C Charger, Fast Charging Wall Charger,All-Round Protection USB C Charger Block for Nothing Phone and iPad Pro, iPhone 12/13/14/15,Galaxy S",39.0,39.0,4.6,47,1,39.0,False,False,True,False,50,"FREE delivery Thu, Sep 26 Or fastest delivery Wed, Sep 25",False
B0D1CWR48M,"Prepaid USA SIM Card, 25GB/365 Day, 4G LTE &amp; 5G on Verizon, T Mobile &amp; ATT, Data Only SIM Card for Unlocked IoT Device, Compatible with Cell Phones, GPS Tracker, Security, Trail Camera",139.0,139.0,4.7,4,1,139.0,False,False,True,False,100,"FREE delivery Tue, Sep 24",False
B0D3WTGSJY,"Ring Light [3 Color, 5 Brightness &amp; Timer] 3.5&#x27;&#x27; Small Video Conference Lighting Clip On Monitor Laptop iPad Phone, USB Plug Dimmable Selfie Light for Working, Meeting, YouTube/TikTok Content Creator",15.99,15.99,4.4,82,1,15.99,False,False,True,False,500,"FREE delivery Tue, Sep 24 on $35 of items shipped by Amazon",False
B0DDY54XPY,"UMIDIGI F3 (8GB+128GB) Unlocked Cell Phone, NFC, Android11, 6.7inch HD Full Screen, 5150mAh Battery, Smartphone with 48MP AI Triple Camera, 18W Fast Charging, Dual SIM",135.99,135.99,3.6,104,1,135.99,False,False,True,False,100,"FREE delivery Wed, Sep 25",False
B0D5CVTSZ1,"Magnetic Neck Mount for Phones, Hands Free POV/Vlog Selfie Mount Flexible Neck Phone Holder for Recording, Magnetic Phone Chest Mount for iPhone 15 14 13 12 Seires and All Smartphones",27.49,29.94,4.6,38,1,27.49,False,False,True,False,300,"FREE delivery Tue, Sep 24 on $35 of items shipped by Amazon",False
B0CZ3YPSRX,"Gimbal Stabilizer for Smartphone, 3-Axis Phone Gimbal Portable and Foldable with AI Tracking Sensor Magnetic Fill Light, Gimbal Stabilizer for iPhone &amp; Android, Phone stabilizer for Video Recording",99.99,99.99,4.7,8,1,99.99,False,False,True,False,100,"FREE delivery Thu, Sep 26",False
B0CHB24KQJ,"[True Military-Grade] Car Phone Holder【2024 Stronger Suction &amp; Clip】 Universal Cell Phone Holder for Car Mount for Dashboard Windshield Air Vent Long Arm Cell Phone Car Mount Thick Case,Purple",39.99,45.99,4.4,2589,1,39.99,False,False,True,False,50,"FREE delivery Tue, Sep 24",False
B01LXOPZ4W,"Wall Mount Cell Phone Charging Shelf | Multi-Device Station with 8 Ports | Compatible with Apple iPhone, iPad, Samsung, Android, Tablets and More! (18&quot; x 9&quot;)",273.0,273.0,4.1,45,1,273.0,False,False,False,False,100,FREE delivery Sep 25 - 30,False
B0CXPJK7F7,"Sensyne 92&quot; Cell Phone Tripod, Selfie Stick Tripod with 16.5&quot; Flexible Gooseneck, Overhead Phone Stand for Video Recording, Photography, Compatible with Phone, Camera",29.99,29.99,4.6,29066,1,29.99,True,False,True,False,300,"FREE delivery Tue, Sep 24 on $35 of items shipped by Amazon",False
B0CQ237PFS,"Portable Charger 33800mAh USB C Power Bank with Built-in Cables &amp; AC Wall Plug,25W Fast Charging+QC 4.0 Phone Charger,4 Output LCD Display Battery Pack Compatible with iPhone15/14,Samsung,Android etc",45.95,69.95,4.4,672,1,45.95,False,False,True,False,3000,"FREE delivery Tue, Sep 24",False
